{
  "schemaVersion": "2.0",
  "scope": {
    "tenantId": "tenant_1",
    "actorId": "actor_1",
    "visitorId": "visitor_1",
    "projectId": "project_1",
    "threadId": "thread_1"
  },
  "events": [
    {
      "schemaVersion": "2.0",
      "eventId": "event_run_cancelled",
      "runId": "run_cancelled",
      "scope": {
        "tenantId": "tenant_1",
        "actorId": "actor_1",
        "visitorId": "visitor_1",
        "projectId": "project_1",
        "threadId": "thread_1"
      },
      "seq": 1,
      "occurredAt": "2026-07-26T13:20:01Z",
      "type": "run.cancelled",
      "kind": "run",
      "status": "cancelled",
      "startedAt": "2026-07-26T13:20:00Z",
      "completedAt": "2026-07-26T13:20:01Z",
      "inputRevision": 0,
      "refs": {},
      "source": "fixture",
      "payload": {
        "stopReason": "user_cancelled",
        "usage": {
          "currency": "USD",
          "modelBreakdown": [],
          "toolBreakdown": [],
          "totals": {
            "modelCalls": 0,
            "toolCalls": 0,
            "searchQueries": 0,
            "pageReads": 0,
            "inputTokens": 0,
            "outputTokens": 0,
            "totalTokens": 0,
            "reasoningTokens": 0,
            "peakParallelTools": 0,
            "elapsedMs": 1000,
            "estimatedCostUsd": "0",
            "actualCostUsd": "0",
            "possibleDuplicateCostUsd": "0"
          }
        },
        "budget": {
          "deadlineAt": "2026-07-26T13:21:00Z",
          "modelCalls": { "max": 4, "used": 0, "reserved": 0, "remaining": 4 },
          "inputTokens": { "max": 1000, "used": 0, "reserved": 0, "remaining": 1000 },
          "outputTokens": { "max": 500, "used": 0, "reserved": 0, "remaining": 500 },
          "costUsd": { "max": "0.01", "used": "0", "reserved": "0", "remaining": "0.01" },
          "planRevisions": { "max": 3, "used": 0, "reserved": 0, "remaining": 3 },
          "searchQueries": { "max": 2, "used": 0, "reserved": 0, "remaining": 2 },
          "pageReads": { "max": 4, "used": 0, "reserved": 0, "remaining": 4 },
          "toolCalls": { "max": 6, "used": 0, "reserved": 0, "remaining": 6 },
          "parallelTools": { "max": 2, "used": 0, "reserved": 0, "remaining": 2 },
          "wallTimeMs": { "max": 10000, "used": 1000, "reserved": 0, "remaining": 9000 },
          "exhausted": false
        }
      }
    }
  ],
  "queueEvents": [
    {
      "schemaVersion": "2.0",
      "eventId": "queue_event_after_cancelled",
      "threadId": "thread_1",
      "scope": { "tenantId": "tenant_1", "actorId": "actor_1", "visitorId": "visitor_1", "projectId": "project_1", "threadId": "thread_1" },
      "queueCursor": 1,
      "queueRevision": 1,
      "occurredAt": "2026-07-26T13:20:02Z",
      "type": "queue.updated",
      "source": "fixture",
      "payload": {
        "transition": "paused",
        "expectedPreviousRevision": 0,
        "trigger": { "runId": "run_cancelled", "terminalStatus": "cancelled" },
        "entries": [],
        "activeRunIds": [],
        "autoStartNext": false,
        "paused": true,
        "pauseReason": "stopped"
      }
    }
  ]
}
