{
  "schemaVersion": "2.0",
  "scope": {
    "tenantId": "tenant_1",
    "actorId": "actor_1",
    "visitorId": "visitor_1",
    "projectId": "project_1",
    "threadId": "thread_1"
  },
  "steeringCommands": [
    {
      "schemaVersion": "2.0",
      "commandId": "command_pending_1",
      "runId": "run_steering_pending",
      "threadId": "thread_1",
      "expectedSteeringRevision": 0,
      "kind": "steer",
      "mode": "at_next_checkpoint",
      "content": "只比较官方文档。",
      "attachmentRefs": [],
      "createdAt": "2026-07-26T15:00:00Z",
      "idempotencyKey": "idem_command_pending_1",
      "contentHash": "7777777777777777777777777777777777777777777777777777777777777777",
      "actor": { "actorId": "actor_1", "actorType": "user" },
      "scope": {
        "tenantId": "tenant_1",
        "actorId": "actor_1",
        "visitorId": "visitor_1",
        "projectId": "project_1",
        "threadId": "thread_1"
      }
    },
    {
      "schemaVersion": "2.0",
      "commandId": "command_pending_1",
      "runId": "run_steering_pending",
      "threadId": "thread_1",
      "expectedSteeringRevision": 0,
      "kind": "steer",
      "mode": "at_next_checkpoint",
      "content": "只比较官方文档。",
      "attachmentRefs": [],
      "createdAt": "2026-07-26T15:00:00Z",
      "idempotencyKey": "idem_command_pending_1",
      "contentHash": "7777777777777777777777777777777777777777777777777777777777777777",
      "actor": { "actorId": "actor_1", "actorType": "user" },
      "scope": {
        "tenantId": "tenant_1",
        "actorId": "actor_1",
        "visitorId": "visitor_1",
        "projectId": "project_1",
        "threadId": "thread_1"
      }
    }
  ],
  "events": [
    {
      "schemaVersion": "2.0",
      "eventId": "event_guidance_pending",
      "runId": "run_steering_pending",
      "scope": {
        "tenantId": "tenant_1",
        "actorId": "actor_1",
        "visitorId": "visitor_1",
        "projectId": "project_1",
        "threadId": "thread_1"
      },
      "seq": 1,
      "occurredAt": "2026-07-26T15:00:01Z",
      "type": "guidance.accepted",
      "kind": "guidance",
      "status": "pending",
      "startedAt": "2026-07-26T15:00:01Z",
      "completedAt": null,
      "inputRevision": 0,
      "refs": { "commandId": "command_pending_1" },
      "source": "fixture",
      "payload": {
        "commandId": "command_pending_1",
        "commandSeq": 1,
        "expectedSteeringRevision": 0,
        "acceptedAtStateRevision": 9,
        "currentSteeringRevision": 0,
        "pendingApply": true,
        "idempotencyKey": "idem_command_pending_1"
      }
    }
  ]
}
